@!@!@STARTMSG 2262:0 @!@!@
TLC2 Version 2.14 of 10 July 2019
@!@!@ENDMSG 2262 @!@!@
@!@!@STARTMSG 2187:0 @!@!@
Running breadth-first search Model-Checking with fp 127 and seed -6035774745920229573 with 6 workers on 8 cores with 3739MB heap and 8405MB offheap memory [pid: 27897] (Linux 5.6.13-200.fc31.x86_64 amd64, AdoptOpenJDK 11.0.3 x86_64, OffHeapDiskFPSet, DiskStateQueue).
@!@!@ENDMSG 2187 @!@!@
@!@!@STARTMSG 2220:0 @!@!@
Starting SANY...
@!@!@ENDMSG 2220 @!@!@
Parsing file /home/matth/projects/tlaplus/infra/UpdateCluster_1.toolbox/Model_1/MC.tla
Parsing file /home/matth/projects/tlaplus/infra/UpdateCluster_1.toolbox/Model_1/UpdateCluster.tla
Parsing file /home/matth/bin/tlatoolbox/plugins/org.lamport.tlatools_1.0.0.201907102009/tla2sany/StandardModules/TLC.tla
Parsing file /home/matth/bin/tlatoolbox/plugins/org.lamport.tlatools_1.0.0.201907102009/tla2sany/StandardModules/Integers.tla
Parsing file /home/matth/bin/tlatoolbox/plugins/org.lamport.tlatools_1.0.0.201907102009/tla2sany/StandardModules/FiniteSets.tla
Parsing file /home/matth/bin/tlatoolbox/plugins/org.lamport.tlatools_1.0.0.201907102009/tla2sany/StandardModules/Naturals.tla
Parsing file /home/matth/bin/tlatoolbox/plugins/org.lamport.tlatools_1.0.0.201907102009/tla2sany/StandardModules/Sequences.tla
Semantic processing of module Naturals
Semantic processing of module Integers
Semantic processing of module Sequences
Semantic processing of module FiniteSets
Semantic processing of module UpdateCluster
Semantic processing of module TLC
Semantic processing of module MC
@!@!@STARTMSG 2219:0 @!@!@
SANY finished.
@!@!@ENDMSG 2219 @!@!@
@!@!@STARTMSG 2185:0 @!@!@
Starting... (2020-06-02 15:52:08)
@!@!@ENDMSG 2185 @!@!@
@!@!@STARTMSG 2212:0 @!@!@
Implied-temporal checking--satisfiability problem has 1 branches.
@!@!@ENDMSG 2212 @!@!@
@!@!@STARTMSG 2189:0 @!@!@
Computing initial states...
@!@!@ENDMSG 2189 @!@!@
@!@!@STARTMSG 2190:0 @!@!@
Finished computing initial states: 2 distinct states generated at 2020-06-02 15:52:10.
@!@!@ENDMSG 2190 @!@!@
@!@!@STARTMSG 2200:0 @!@!@
Progress(16) at 2020-06-02 15:52:11: 6,332 states generated, 2,909 distinct states found, 0 states left on queue.
@!@!@ENDMSG 2200 @!@!@
@!@!@STARTMSG 2192:0 @!@!@
Checking temporal properties for the complete state space with 2909 total distinct states at (2020-06-02 15:52:11)
@!@!@ENDMSG 2192 @!@!@
@!@!@STARTMSG 2267:0 @!@!@
Finished checking temporal properties in 00s at 2020-06-02 15:52:11
@!@!@ENDMSG 2267 @!@!@
@!@!@STARTMSG 2193:0 @!@!@
Model checking completed. No error has been found.
  Estimates of the probability that TLC did not check all reachable states
  because two distinct states had the same fingerprint:
  calculated (optimistic):  val = 5.4E-13
@!@!@ENDMSG 2193 @!@!@
@!@!@STARTMSG 2201:0 @!@!@
The coverage statistics at 2020-06-02 15:52:11
@!@!@ENDMSG 2201 @!@!@
@!@!@STARTMSG 2773:0 @!@!@
<Init line 50, col 1 to line 50, col 4 of module UpdateCluster>: 2:2
@!@!@ENDMSG 2773 @!@!@
@!@!@STARTMSG 2221:0 @!@!@
  line 51, col 8 to line 51, col 70 of module UpdateCluster: 1
@!@!@ENDMSG 2221 @!@!@
@!@!@STARTMSG 2221:0 @!@!@
  line 52, col 8 to line 52, col 68 of module UpdateCluster: 1
@!@!@ENDMSG 2221 @!@!@
@!@!@STARTMSG 2221:0 @!@!@
  line 53, col 8 to line 53, col 41 of module UpdateCluster: 1
@!@!@ENDMSG 2221 @!@!@
@!@!@STARTMSG 2221:0 @!@!@
  line 57, col 8 to line 57, col 25 of module UpdateCluster: 1
@!@!@ENDMSG 2221 @!@!@
@!@!@STARTMSG 2221:0 @!@!@
  line 58, col 8 to line 58, col 30 of module UpdateCluster: 2
@!@!@ENDMSG 2221 @!@!@
@!@!@STARTMSG 2772:0 @!@!@
<Submit line 67, col 1 to line 67, col 9 of module UpdateCluster (70 5 73 80)>: 68:636
@!@!@ENDMSG 2772 @!@!@
@!@!@STARTMSG 2221:0 @!@!@
  line 70, col 8 to line 70, col 33 of module UpdateCluster: 9363
@!@!@ENDMSG 2221 @!@!@
@!@!@STARTMSG 2221:0 @!@!@
  |line 70, col 8 to line 70, col 21 of module UpdateCluster: 8727
@!@!@ENDMSG 2221 @!@!@
@!@!@STARTMSG 2221:0 @!@!@
  line 71, col 8 to line 71, col 25 of module UpdateCluster: 636
@!@!@ENDMSG 2221 @!@!@
@!@!@STARTMSG 2221:0 @!@!@
  line 72, col 8 to line 72, col 73 of module UpdateCluster: 636
@!@!@ENDMSG 2221 @!@!@
@!@!@STARTMSG 2221:0 @!@!@
  line 73, col 8 to line 73, col 80 of module UpdateCluster: 636
@!@!@ENDMSG 2221 @!@!@
@!@!@STARTMSG 2772:0 @!@!@
<PushToPending line 76, col 1 to line 76, col 16 of module UpdateCluster>: 566:1794
@!@!@ENDMSG 2772 @!@!@
@!@!@STARTMSG 2221:0 @!@!@
  line 78, col 8 to line 78, col 35 of module UpdateCluster: 10521
@!@!@ENDMSG 2221 @!@!@
@!@!@STARTMSG 2221:0 @!@!@
  |line 78, col 8 to line 78, col 21 of module UpdateCluster: 8727
@!@!@ENDMSG 2221 @!@!@
@!@!@STARTMSG 2221:0 @!@!@
  line 79, col 11 to line 79, col 33 of module UpdateCluster: 1794
@!@!@ENDMSG 2221 @!@!@
@!@!@STARTMSG 2221:0 @!@!@
  line 80, col 17 to line 80, col 64 of module UpdateCluster: 474
@!@!@ENDMSG 2221 @!@!@
@!@!@STARTMSG 2221:0 @!@!@
  line 81, col 17 to line 81, col 40 of module UpdateCluster: 474
@!@!@ENDMSG 2221 @!@!@
@!@!@STARTMSG 2221:0 @!@!@
  line 82, col 17 to line 82, col 92 of module UpdateCluster: 474
@!@!@ENDMSG 2221 @!@!@
@!@!@STARTMSG 2221:0 @!@!@
  line 83, col 17 to line 83, col 66 of module UpdateCluster: 1320
@!@!@ENDMSG 2221 @!@!@
@!@!@STARTMSG 2221:0 @!@!@
  line 84, col 17 to line 84, col 101 of module UpdateCluster: 1320
@!@!@ENDMSG 2221 @!@!@
@!@!@STARTMSG 2772:0 @!@!@
<SpawnWorker line 87, col 1 to line 87, col 14 of module UpdateCluster>: 1014:1026
@!@!@ENDMSG 2772 @!@!@
@!@!@STARTMSG 2221:0 @!@!@
  line 89, col 8 to line 89, col 25 of module UpdateCluster: 6844
@!@!@ENDMSG 2221 @!@!@
@!@!@STARTMSG 2221:0 @!@!@
  |line 89, col 8 to line 89, col 14 of module UpdateCluster: 5818
@!@!@ENDMSG 2221 @!@!@
@!@!@STARTMSG 2221:0 @!@!@
  |line 89, col 19 to line 89, col 25 of module UpdateCluster: 5818
@!@!@ENDMSG 2221 @!@!@
@!@!@STARTMSG 2221:0 @!@!@
  line 90, col 8 to line 90, col 32 of module UpdateCluster: 6168
@!@!@ENDMSG 2221 @!@!@
@!@!@STARTMSG 2221:0 @!@!@
  |line 90, col 8 to line 90, col 20 of module UpdateCluster: 5142
@!@!@ENDMSG 2221 @!@!@
@!@!@STARTMSG 2221:0 @!@!@
  line 91, col 8 to line 91, col 30 of module UpdateCluster: 4110
@!@!@ENDMSG 2221 @!@!@
@!@!@STARTMSG 2221:0 @!@!@
  |line 91, col 8 to line 91, col 22 of module UpdateCluster: 3084
@!@!@ENDMSG 2221 @!@!@
@!@!@STARTMSG 2221:0 @!@!@
  |line 91, col 26 to line 91, col 30 of module UpdateCluster: 3084
@!@!@ENDMSG 2221 @!@!@
@!@!@STARTMSG 2221:0 @!@!@
  line 92, col 12 to line 92, col 30 of module UpdateCluster: 1542
@!@!@ENDMSG 2221 @!@!@
@!@!@STARTMSG 2221:0 @!@!@
  |line 92, col 12 to line 92, col 21 of module UpdateCluster: 1026
@!@!@ENDMSG 2221 @!@!@
@!@!@STARTMSG 2221:0 @!@!@
  line 93, col 12 to line 93, col 32 of module UpdateCluster: 1536
@!@!@ENDMSG 2221 @!@!@
@!@!@STARTMSG 2221:0 @!@!@
  |line 93, col 12 to line 93, col 21 of module UpdateCluster: 1026
@!@!@ENDMSG 2221 @!@!@
@!@!@STARTMSG 2221:0 @!@!@
  line 94, col 8 to line 94, col 73 of module UpdateCluster: 1026
@!@!@ENDMSG 2221 @!@!@
@!@!@STARTMSG 2221:0 @!@!@
  line 95, col 8 to line 95, col 30 of module UpdateCluster: 1026
@!@!@ENDMSG 2221 @!@!@
@!@!@STARTMSG 2221:0 @!@!@
  line 96, col 8 to line 96, col 76 of module UpdateCluster: 1026
@!@!@ENDMSG 2221 @!@!@
@!@!@STARTMSG 2772:0 @!@!@
<ApplyStart line 100, col 1 to line 100, col 13 of module UpdateCluster>: 705:1242
@!@!@ENDMSG 2772 @!@!@
@!@!@STARTMSG 2221:0 @!@!@
  line 102, col 8 to line 102, col 33 of module UpdateCluster: 7060
@!@!@ENDMSG 2221 @!@!@
@!@!@STARTMSG 2221:0 @!@!@
  |line 102, col 8 to line 102, col 20 of module UpdateCluster: 5818
@!@!@ENDMSG 2221 @!@!@
@!@!@STARTMSG 2221:0 @!@!@
  line 103, col 11 to line 103, col 33 of module UpdateCluster: 1242
@!@!@ENDMSG 2221 @!@!@
@!@!@STARTMSG 2221:0 @!@!@
  line 105, col 16 to line 105, col 21 of module UpdateCluster: 1026
@!@!@ENDMSG 2221 @!@!@
@!@!@STARTMSG 2221:0 @!@!@
  line 107, col 24 to line 107, col 72 of module UpdateCluster: 816
@!@!@ENDMSG 2221 @!@!@
@!@!@STARTMSG 2221:0 @!@!@
  line 108, col 24 to line 108, col 70 of module UpdateCluster: 816
@!@!@ENDMSG 2221 @!@!@
@!@!@STARTMSG 2221:0 @!@!@
  line 109, col 24 to line 109, col 100 of module UpdateCluster: 816
@!@!@ENDMSG 2221 @!@!@
@!@!@STARTMSG 2221:0 @!@!@
  line 111, col 24 to line 111, col 47 of module UpdateCluster: 210
@!@!@ENDMSG 2221 @!@!@
@!@!@STARTMSG 2221:0 @!@!@
  line 112, col 24 to line 112, col 85 of module UpdateCluster: 210
@!@!@ENDMSG 2221 @!@!@
@!@!@STARTMSG 2221:0 @!@!@
  line 113, col 24 to line 113, col 92 of module UpdateCluster: 210
@!@!@ENDMSG 2221 @!@!@
@!@!@STARTMSG 2221:0 @!@!@
  line 115, col 16 to line 115, col 77 of module UpdateCluster: 216
@!@!@ENDMSG 2221 @!@!@
@!@!@STARTMSG 2221:0 @!@!@
  line 116, col 16 to line 116, col 39 of module UpdateCluster: 216
@!@!@ENDMSG 2221 @!@!@
@!@!@STARTMSG 2221:0 @!@!@
  line 117, col 16 to line 117, col 84 of module UpdateCluster: 216
@!@!@ENDMSG 2221 @!@!@
@!@!@STARTMSG 2772:0 @!@!@
<ApplyFinish line 125, col 1 to line 125, col 14 of module UpdateCluster>: 554:1632
@!@!@ENDMSG 2772 @!@!@
@!@!@STARTMSG 2221:0 @!@!@
  line 127, col 8 to line 127, col 32 of module UpdateCluster: 6634
@!@!@ENDMSG 2221 @!@!@
@!@!@STARTMSG 2221:0 @!@!@
  |line 127, col 8 to line 127, col 20 of module UpdateCluster: 5818
@!@!@ENDMSG 2221 @!@!@
@!@!@STARTMSG 2221:0 @!@!@
  line 128, col 8 to line 128, col 31 of module UpdateCluster: 816
@!@!@ENDMSG 2221 @!@!@
@!@!@STARTMSG 2221:0 @!@!@
  line 130, col 12 to line 130, col 47 of module UpdateCluster: 1632
@!@!@ENDMSG 2221 @!@!@
@!@!@STARTMSG 2221:0 @!@!@
  |line 130, col 12 to line 130, col 13 of module UpdateCluster: 1632
@!@!@ENDMSG 2221 @!@!@
@!@!@STARTMSG 2221:0 @!@!@
  |line 130, col 18 to line 130, col 47 of module UpdateCluster: 816
@!@!@ENDMSG 2221 @!@!@
@!@!@STARTMSG 2221:0 @!@!@
  line 132, col 20 to line 132, col 61 of module UpdateCluster: 1218
@!@!@ENDMSG 2221 @!@!@
@!@!@STARTMSG 2221:0 @!@!@
  line 133, col 20 to line 133, col 42 of module UpdateCluster: 1218
@!@!@ENDMSG 2221 @!@!@
@!@!@STARTMSG 2221:0 @!@!@
  line 134, col 20 to line 134, col 81 of module UpdateCluster: 1218
@!@!@ENDMSG 2221 @!@!@
@!@!@STARTMSG 2221:0 @!@!@
  line 135, col 20 to line 135, col 70 of module UpdateCluster: 1218
@!@!@ENDMSG 2221 @!@!@
@!@!@STARTMSG 2221:0 @!@!@
  line 137, col 20 to line 137, col 63 of module UpdateCluster: 414
@!@!@ENDMSG 2221 @!@!@
@!@!@STARTMSG 2221:0 @!@!@
  line 138, col 20 to line 138, col 81 of module UpdateCluster: 414
@!@!@ENDMSG 2221 @!@!@
@!@!@STARTMSG 2221:0 @!@!@
  line 139, col 23 to line 139, col 44 of module UpdateCluster: 414
@!@!@ENDMSG 2221 @!@!@
@!@!@STARTMSG 2221:0 @!@!@
  line 141, col 28 to line 141, col 87 of module UpdateCluster: 108
@!@!@ENDMSG 2221 @!@!@
@!@!@STARTMSG 2221:0 @!@!@
  line 143, col 28 to line 143, col 53 of module UpdateCluster: 306
@!@!@ENDMSG 2221 @!@!@
@!@!@STARTMSG 2221:0 @!@!@
  line 144, col 28 to line 144, col 78 of module UpdateCluster: 306
@!@!@ENDMSG 2221 @!@!@
@!@!@STARTMSG 2221:0 @!@!@
  line 129, col 18 to line 129, col 24 of module UpdateCluster: 816
@!@!@ENDMSG 2221 @!@!@
@!@!@STARTMSG 2774:0 @!@!@
<TypeInvariants line 24, col 1 to line 24, col 14 of module UpdateCluster>
@!@!@ENDMSG 2774 @!@!@
@!@!@STARTMSG 2221:0 @!@!@
  line 25, col 5 to line 43, col 9 of module UpdateCluster: 2909
@!@!@ENDMSG 2221 @!@!@
@!@!@STARTMSG 2221:0 @!@!@
  |line 25, col 8 to line 25, col 25 of module UpdateCluster: 2909
@!@!@ENDMSG 2221 @!@!@
@!@!@STARTMSG 2221:0 @!@!@
  |line 26, col 8 to line 26, col 34 of module UpdateCluster: 2909
@!@!@ENDMSG 2221 @!@!@
@!@!@STARTMSG 2221:0 @!@!@
  |line 27, col 8 to line 32, col 9 of module UpdateCluster: 2909
@!@!@ENDMSG 2221 @!@!@
@!@!@STARTMSG 2221:0 @!@!@
  |line 33, col 8 to line 38, col 9 of module UpdateCluster: 2909
@!@!@ENDMSG 2221 @!@!@
@!@!@STARTMSG 2221:0 @!@!@
  ||line 33, col 29 to line 38, col 9 of module UpdateCluster: 8727
@!@!@ENDMSG 2221 @!@!@
@!@!@STARTMSG 2221:0 @!@!@
  ||line 33, col 17 to line 33, col 25 of module UpdateCluster: 2909
@!@!@ENDMSG 2221 @!@!@
@!@!@STARTMSG 2221:0 @!@!@
  |line 39, col 8 to line 43, col 9 of module UpdateCluster: 2909
@!@!@ENDMSG 2221 @!@!@
@!@!@STARTMSG 2221:0 @!@!@
  ||line 39, col 28 to line 43, col 9 of module UpdateCluster: 5818
@!@!@ENDMSG 2221 @!@!@
@!@!@STARTMSG 2221:0 @!@!@
  ||line 39, col 17 to line 39, col 24 of module UpdateCluster: 2909
@!@!@ENDMSG 2221 @!@!@
@!@!@STARTMSG 2774:0 @!@!@
<Action line 179, col 8 to line 179, col 73 of module UpdateCluster>
@!@!@ENDMSG 2774 @!@!@
@!@!@STARTMSG 2221:0 @!@!@
  line 179, col 8 to line 179, col 73 of module UpdateCluster: 2909
@!@!@ENDMSG 2221 @!@!@
@!@!@STARTMSG 2221:0 @!@!@
  |line 179, col 8 to line 179, col 69 of module UpdateCluster: 2909
@!@!@ENDMSG 2221 @!@!@
@!@!@STARTMSG 2221:0 @!@!@
  ||line 179, col 20 to line 179, col 68 of module UpdateCluster: 2909
@!@!@ENDMSG 2221 @!@!@
@!@!@STARTMSG 2221:0 @!@!@
  |||line 179, col 43 to line 179, col 67 of module UpdateCluster: 5818
@!@!@ENDMSG 2221 @!@!@
@!@!@STARTMSG 2221:0 @!@!@
  |||line 179, col 27 to line 179, col 40 of module UpdateCluster: 2909
@!@!@ENDMSG 2221 @!@!@
@!@!@STARTMSG 2202:0 @!@!@
End of statistics.
@!@!@ENDMSG 2202 @!@!@
@!@!@STARTMSG 2200:0 @!@!@
Progress(16) at 2020-06-02 15:52:11: 6,332 states generated (121,109 s/min), 2,909 distinct states found (55,639 ds/min), 0 states left on queue.
@!@!@ENDMSG 2200 @!@!@
@!@!@STARTMSG 2199:0 @!@!@
6332 states generated, 2909 distinct states found, 0 states left on queue.
@!@!@ENDMSG 2199 @!@!@
@!@!@STARTMSG 2194:0 @!@!@
The depth of the complete state graph search is 16.
@!@!@ENDMSG 2194 @!@!@
@!@!@STARTMSG 2268:0 @!@!@
The average outdegree of the complete state graph is 1 (minimum is 0, the maximum 4 and the 95th percentile is 3).
@!@!@ENDMSG 2268 @!@!@
@!@!@STARTMSG 2186:0 @!@!@
Finished in 3146ms at (2020-06-02 15:52:11)
@!@!@ENDMSG 2186 @!@!@
